{
  "$schema": "https://json-schema.org/draft/2020-12/schema",
  "type": "object",
  "properties": {
    "eventId": {
      "type": "string",
      "minLength": 1,
      "maxLength": 64
    },
    "interactionId": {
      "type": "string",
      "minLength": 1,
      "maxLength": 64
    },
    "eventType": {
      "type": "string",
      "enum": [
        "interaction.started",
        "model.output_generated",
        "review.completed",
        "interaction.completed",
        "interaction.stopped",
        "record.corrected"
      ]
    },
    "occurredAt": {
      "type": "string",
      "format": "date-time",
      "pattern": "^\\d{4}-\\d{2}-\\d{2}T\\d{2}:\\d{2}:\\d{2}(?:\\.\\d+)?(?:Z|\\+00:00)$"
    },
    "modelVersion": {
      "type": "string",
      "minLength": 1,
      "maxLength": 64
    },
    "applicationVersion": {
      "type": "string",
      "minLength": 1,
      "maxLength": 64
    },
    "data": {
      "type": "object"
    }
  },
  "required": [
    "eventId",
    "interactionId",
    "eventType",
    "occurredAt",
    "modelVersion",
    "applicationVersion",
    "data"
  ],
  "additionalProperties": false,
  "allOf": [
    {
      "if": {
        "properties": {
          "eventType": {
            "const": "review.completed"
          }
        },
        "required": [
          "eventType"
        ]
      },
      "then": {
        "properties": {
          "data": {
            "type": "object",
            "properties": {
              "reviewerId": {
                "type": "string"
              },
              "action": {
                "type": "string",
                "enum": [
                  "accept",
                  "override",
                  "reject",
                  "escalate"
                ]
              },
              "reason": {
                "type": "string",
                "minLength": 1,
                "maxLength": 500
              }
            },
            "required": [
              "reviewerId",
              "action",
              "reason"
            ]
          }
        }
      }
    },
    {
      "if": {
        "properties": {
          "eventType": {
            "const": "record.corrected"
          }
        },
        "required": [
          "eventType"
        ]
      },
      "then": {
        "properties": {
          "data": {
            "type": "object",
            "properties": {
              "correctsEventId": {
                "type": "string",
                "minLength": 1,
                "maxLength": 64
              },
              "reason": {
                "type": "string",
                "minLength": 1,
                "maxLength": 500
              }
            },
            "required": [
              "correctsEventId",
              "reason"
            ]
          }
        }
      }
    }
  ]
}
