[
  {
    "eventId": "evt-a-01",
    "interactionId": "int-a",
    "eventType": "interaction.started",
    "occurredAt": "2026-10-15T14:30:00Z",
    "modelVersion": "model-2.1",
    "applicationVersion": "app-1.4",
    "data": {}
  },
  {
    "eventId": "evt-b-01",
    "interactionId": "int-b",
    "eventType": "interaction.started",
    "occurredAt": "2026-10-15T14:30:00Z",
    "modelVersion": "model-2.1",
    "applicationVersion": "app-1.4",
    "data": {}
  },
  {
    "eventId": "evt-a-03",
    "interactionId": "int-a",
    "eventType": "interaction.completed",
    "occurredAt": "2026-10-15T14:32:00Z",
    "modelVersion": "model-2.1",
    "applicationVersion": "app-1.4",
    "data": {}
  },
  {
    "eventId": "evt-a-02",
    "interactionId": "int-a",
    "eventType": "model.output_generated",
    "occurredAt": "2026-10-15T14:31:00Z",
    "modelVersion": "model-2.1",
    "applicationVersion": "app-1.4",
    "data": {
      "outputReference": "synthetic-output-17"
    }
  },
  {
    "eventId": "evt-review",
    "interactionId": "int-review",
    "eventType": "review.completed",
    "occurredAt": "2026-10-15T14:33:00Z",
    "modelVersion": "model-2.1",
    "applicationVersion": "app-1.4",
    "data": {
      "reviewerId": "reviewer-1",
      "action": "accept",
      "reason": "Synthetic classroom review"
    }
  },
  {
    "eventId": "evt-correction",
    "interactionId": "int-review",
    "eventType": "record.corrected",
    "occurredAt": "2026-10-15T14:34:00Z",
    "modelVersion": "model-2.1",
    "applicationVersion": "app-1.4",
    "data": {
      "correctsEventId": "evt-review",
      "reason": "Synthetic correction"
    }
  }
]
